14:30:07.887021 IP 127.0.0.1.55107 > 127.0.0.1.4242: UDP, length 24
E..4.%@.@.e..........C... .3CMDidentify#........fred
14:30:07.887107 IP 127.0.0.1.4242 > 127.0.0.1.55107: UDP, length 20
E..0.&@.@.e............C.../RESidentify#........
14:30:07.887162 IP 127.0.0.1.55107 > 127.0.0.1.4242: UDP, length 16
E..,.'@.@.e..........C.....+CMDinfo#........
14:30:07.887208 IP 127.0.0.1.4242 > 127.0.0.1.55107: UDP, length 20
E..0.(@.@.e............C.../RESinfo#........info
14:30:07.887229 IP 127.0.0.1.55107 > 127.0.0.1.4242: UDP, length 17
E..-.)@.@.e..........C.....,CMDstats#........
14:30:07.887271 IP 127.0.0.1.4242 > 127.0.0.1.55107: UDP, length 22
E..2.*@.@.e............C...1RESstats#........stats
14:30:07.887293 IP 127.0.0.1.55107 > 127.0.0.1.4242: UDP, length 31
E..;.+@.@.e..........C...'.:CMDauthentify#	.......myPasswd!
14:30:07.887336 IP 127.0.0.1.4242 > 127.0.0.1.55107: UDP, length 22
E..2.,@.@.e............C...1RESauthentify#........
14:30:07.887364 IP 127.0.0.1.55107 > 127.0.0.1.4242: UDP, length 29
E..9.-@.@.e..........C...%.8CMDencrypt#
.......123456test
14:30:07.887414 IP 127.0.0.1.4242 > 127.0.0.1.55107: UDP, length 29
E..9..@.@.e............C.%.8RESencrypt#....
...spqvwt6'16
14:30:07.887443 IP 127.0.0.1.55107 > 127.0.0.1.4242: UDP, length 29
E..9./@.@.e..........C...%.8CMDdecrypt#
.......spqvwt6'16
14:30:07.887493 IP 127.0.0.1.4242 > 127.0.0.1.55107: UDP, length 29
E..9.0@.@.e............C.%.8RESdecrypt#....
...123456test
14:30:07.887517 IP 127.0.0.1.55107 > 127.0.0.1.4242: UDP, length 15
E..+.1@.@.e..........C.....*CMDbye#........
14:30:07.887555 IP 127.0.0.1.4242 > 127.0.0.1.55107: UDP, length 15
E..+.2@.@.e............C...*RESbye#........
14:30:07.887580 IP 127.0.0.1.55107 > 127.0.0.1.4242: UDP, length 27
E..7.3@.@.e..........C...#.6CMDidentify#........Roberto
14:30:07.887619 IP 127.0.0.1.4242 > 127.0.0.1.55107: UDP, length 20
E..0.4@.@.e............C.../RESidentify#........
14:30:07.887643 IP 127.0.0.1.55107 > 127.0.0.1.4242: UDP, length 16
E..,.5@.@.e..........C.....+CMDinfo#........
14:30:07.887680 IP 127.0.0.1.4242 > 127.0.0.1.55107: UDP, length 20
E..0.6@.@.e............C.../RESinfo#........info
14:30:07.887713 IP 127.0.0.1.55107 > 127.0.0.1.4242: UDP, length 17
E..-.7@.@.e..........C.....,CMDstats#........
14:30:07.887750 IP 127.0.0.1.4242 > 127.0.0.1.55107: UDP, length 22
E..2.8@.@.e............C...1RESstats#........stats
14:30:07.887769 IP 127.0.0.1.55107 > 127.0.0.1.4242: UDP, length 32
E..<.9@.@.eu.........C...(.;CMDauthentify#
.......aStrongPwd
14:30:07.887795 IP 127.0.0.1.4242 > 127.0.0.1.55107: UDP, length 22
E..2.:@.@.e~...........C...1RESauthentify#........
14:30:07.887814 IP 127.0.0.1.55107 > 127.0.0.1.4242: UDP, length 25
E..5.;@.@.ez.........C...!.4CMDencrypt#........abcdef
14:30:07.887853 IP 127.0.0.1.4242 > 127.0.0.1.55107: UDP, length 25
E..5.<@.@.ey...........C.!.4RESencrypt#........# !&'$
14:30:07.887878 IP 127.0.0.1.55107 > 127.0.0.1.4242: UDP, length 25
E..5.=@.@.ex.........C...!.4CMDdecrypt#........# !&'$
14:30:07.887915 IP 127.0.0.1.4242 > 127.0.0.1.55107: UDP, length 25
E..5.>@.@.ew...........C.!.4RESdecrypt#........abcdef
14:30:07.887939 IP 127.0.0.1.55107 > 127.0.0.1.4242: UDP, length 15
E..+.?@.@.e..........C.....*CMDbye#........
14:30:07.887968 IP 127.0.0.1.4242 > 127.0.0.1.55107: UDP, length 15
E..+.@@.@.e............C...*RESbye#........
14:30:07.887993 IP 127.0.0.1.55107 > 127.0.0.1.4242: UDP, length 27
E..7.A@.@.er.........C...#.6CMDidentify#........Roberto
14:30:07.888027 IP 127.0.0.1.4242 > 127.0.0.1.55107: UDP, length 20
E..0.B@.@.ex...........C.../RESidentify#........
14:30:07.888052 IP 127.0.0.1.55107 > 127.0.0.1.4242: UDP, length 16
E..,.C@.@.e{.........C.....+CMDinfo#........
14:30:07.888086 IP 127.0.0.1.4242 > 127.0.0.1.55107: UDP, length 20
E..0.D@.@.ev...........C.../RESinfo#........info
14:30:07.888106 IP 127.0.0.1.55107 > 127.0.0.1.4242: UDP, length 17
E..-.E@.@.ex.........C.....,CMDstats#........
14:30:07.888142 IP 127.0.0.1.4242 > 127.0.0.1.55107: UDP, length 22
E..2.F@.@.er...........C...1RESstats#........stats
14:30:07.888163 IP 127.0.0.1.55107 > 127.0.0.1.4242: UDP, length 32
E..<.G@.@.eg.........C...(.;CMDauthentify#
.......aStrongPwd
14:30:07.888199 IP 127.0.0.1.4242 > 127.0.0.1.55107: UDP, length 22
E..2.H@.@.ep...........C...1RESauthentify#........
14:30:07.888220 IP 127.0.0.1.55107 > 127.0.0.1.4242: UDP, length 25
E..5.I@.@.el.........C...!.4CMDdecrypt#........# !&'$
14:30:07.888259 IP 127.0.0.1.4242 > 127.0.0.1.55107: UDP, length 25
E..5.J@.@.ek...........C.!.4RESdecrypt#........abcdef
14:30:07.888284 IP 127.0.0.1.55107 > 127.0.0.1.4242: UDP, length 15
E..+.K@.@.et.........C.....*CMDbye#........
14:30:07.888316 IP 127.0.0.1.4242 > 127.0.0.1.55107: UDP, length 15
E..+.L@.@.es...........C...*RESbye#........
14:30:07.888341 IP 127.0.0.1.55107 > 127.0.0.1.4242: UDP, length 22
E..2.M@.@.ek.........C.....1CMDidentify#........aa
14:30:07.888377 IP 127.0.0.1.4242 > 127.0.0.1.55107: UDP, length 20
E..0.N@.@.el...........C.../RESidentify#........
14:30:07.888400 IP 127.0.0.1.55107 > 127.0.0.1.4242: UDP, length 19
E../.O@.@.el.........C......CMDinfo#........bbb
14:30:07.888439 IP 127.0.0.1.4242 > 127.0.0.1.55107: UDP, length 20
E..0.P@.@.ej...........C.../RESinfo#........info
14:30:07.888466 IP 127.0.0.1.55107 > 127.0.0.1.4242: UDP, length 21
E..1.Q@.@.eh.........C.....0CMDstats#........c123
14:30:07.888501 IP 127.0.0.1.4242 > 127.0.0.1.55107: UDP, length 22
E..2.R@.@.ef...........C...1RESstats#........stats
14:30:07.888524 IP 127.0.0.1.55107 > 127.0.0.1.4242: UDP, length 25
E..5.S@.@.eb.........C...!.4CMDauthentify#........ttt
14:30:07.888589 IP 127.0.0.1.4242 > 127.0.0.1.55107: UDP, length 22
E..2.T@.@.ed...........C...1RESauthentify#........
14:30:07.888630 IP 127.0.0.1.55107 > 127.0.0.1.4242: UDP, length 23
E..3.U@.@.eb.........C.....2CMDdecrypt#........fdsa
14:30:07.888688 IP 127.0.0.1.4242 > 127.0.0.1.55107: UDP, length 23
E..3.V@.@.ea...........C...2RESdecrypt#........$&1#
14:30:07.888725 IP 127.0.0.1.55107 > 127.0.0.1.4242: UDP, length 18
E....W@.@.ee.........C.....-CMDbye#........bye
14:30:07.888783 IP 127.0.0.1.4242 > 127.0.0.1.55107: UDP, length 15
E..+.X@.@.eg...........C...*RESbye#........
14:30:07.888822 IP 127.0.0.1.55107 > 127.0.0.1.4242: UDP, length 22
E..2.Y@.@.e_.........C.....1CMDidentify#........cc
14:30:07.888876 IP 127.0.0.1.4242 > 127.0.0.1.55107: UDP, length 20
E..0.Z@.@.e`...........C.../RESidentify#........
14:30:07.888916 IP 127.0.0.1.55107 > 127.0.0.1.4242: UDP, length 16
E..,.[@.@.ec.........C.....+CMDinfo#........
14:30:07.888967 IP 127.0.0.1.4242 > 127.0.0.1.55107: UDP, length 20
E..0.\@.@.e^...........C.../RESinfo#........info
14:30:07.889006 IP 127.0.0.1.55107 > 127.0.0.1.4242: UDP, length 17
E..-.]@.@.e`.........C.....,CMDstats#........
14:30:07.889062 IP 127.0.0.1.4242 > 127.0.0.1.55107: UDP, length 22
E..2.^@.@.eZ...........C...1RESstats#........stats
14:30:07.889098 IP 127.0.0.1.55107 > 127.0.0.1.4242: UDP, length 25
E..5._@.@.eV.........C...!.4CMDauthentify#........aaa
14:30:07.889158 IP 127.0.0.1.4242 > 127.0.0.1.55107: UDP, length 22
E..2.`@.@.eX...........C...1RESauthentify#........
14:30:07.889199 IP 127.0.0.1.55107 > 127.0.0.1.4242: UDP, length 32
E..<.a@.@.eM.........C...(.;CMDdecrypt#........8/+dafsdfdsff
14:30:07.889256 IP 127.0.0.1.4242 > 127.0.0.1.55107: UDP, length 32
E..<.b@.@.eL...........C.(.;RESdecrypt#........zmi&#$1&$&1$%
14:30:07.889293 IP 127.0.0.1.55107 > 127.0.0.1.4242: UDP, length 15
E..+.c@.@.e\.........C.....*CMDbye#........
14:30:07.889346 IP 127.0.0.1.4242 > 127.0.0.1.55107: UDP, length 15
E..+.d@.@.e[...........C...*RESbye#........
